{
  "schema": "c2.review-request/v1",
  "title": "Approve design and test plan",
  "summary_markdown": "Review the expected ordering behavior and its acceptance test before implementation.",
  "decisions": [
    {
      "id": "approve",
      "label": "Approve design and test plan",
      "accepts_reviewed_content": true,
      "feedback_required": false
    },
    {
      "id": "revise",
      "label": "Revise the plan",
      "accepts_reviewed_content": false,
      "feedback_required": true
    }
  ],
  "files": [
    {
      "id": "design",
      "title": "Design",
      "media_type": "text/markdown",
      "artifact_ref": {
        "kind": "stored",
        "name": "design.md",
        "stored": {
          "key": {
            "jobId": "job-build-demo",
            "taskOrdinal": 10,
            "name": "design.md",
            "sizeBytes": 49
          }
        }
      },
      "annotations": "criticmarkup",
      "sha256": "489f63b748f8123b744c5b26dc7fb7da46c0ccfe0156557bcaee1a1c6e42762d",
      "download_url": "/api/projects/project-demo/jobs/job-build-demo/tasks/10/artifacts/design.md"
    },
    {
      "id": "test-statements",
      "title": "Test statements",
      "media_type": "text/markdown",
      "artifact_ref": {
        "kind": "stored",
        "name": "test-statements.md",
        "stored": {
          "key": {
            "jobId": "job-build-demo",
            "taskOrdinal": 11,
            "name": "test-statements.md",
            "sizeBytes": 136
          }
        }
      },
      "annotations": "criticmarkup",
      "sha256": "aba83f511f1431882e3e81ae09748e781467cb963b3abc85113df3e814d40141",
      "download_url": "/api/projects/project-demo/jobs/job-build-demo/tasks/11/artifacts/test-statements.md"
    }
  ],
  "review_id": "review-demo-1",
  "origin": {
    "project_id": "project-demo",
    "job_id": "job-build-demo",
    "input_id": "input-plan-demo"
  }
}
